{
  "schema_version": "1.0.0",
  "action_id": "act_courtesy_reminder_v1",
  "action_type": "courtesy_reminder",
  "channel": "sms",
  "direct_cost_usd": 1.5,
  "personnel_hours": 0.0,
  "regulatory_cooling_off_days": 30,
  "minimum_policy_tenure_days": 30,
  "maximum_policy_tenure_days": null,
  "requires_grace_period": false
}

